,star,helpful,title,text
1779,1.0,10,Review,normally never write review felt misled positive review high rating bike wanted cardio equipment get job done comfortably indoors bike really failed simple performance seat uncomfortable sit minute also maintain position easily bent place even use product falling get fixed continue occur work amount tension resistance wheel increasing resistance even slightest bit make living room smell burnt rubber increasing resistance also cause cycling unstable jagged performance smooth frustrating use ended decorative piece living room star bike fitness star bike decorative piece
1780,5.0,0,good buy,im pro spin class sturdy ride nice
1781,5.0,0,Great Product at a Great Price,arrived time actually early damge box product took minute unpack box minute assemble function well used spin class gym good quality quiet overall great value money
1782,5.0,0,Amazing bike,absolutely amazing saddle small weight lb love bike
1783,5.0,0,Five Stars,love bike great work well satisfied
1784,4.0,0,Great bike for the price!,assembled bike minute noisy quiet love disappointed great price
1785,4.0,2,Surprisingly good piece of exercise equipment,rarely write review product really pleased bike great indoor trainer easy assemble well built pleased
1786,5.0,0,Good product good price,anything negative say good product good price
1787,5.0,0,Love it,great bike
1788,4.0,1,Good for the Price,beat price came box looked return checked assembled bike little difficulty job going gym put tv front spin dvd job best part put bike video wife love
1789,1.0,1,Unusable,ordered twice arrived damaged unusable
1790,2.0,0,"The bike couldnt be put together, missing piece.",excited assemble try bike starting put together realized missing piece connects handlebar waiting hear back new piece returning maybe trying wasnt really anticipating waiting longer disappointed
1791,5.0,0,Great for home use,absolutely love bike spin class price great easy put together sturdy
1792,5.0,0,Great Bike,great buy smooth ride perfect home workout tell difference expensive bike gym looking sporting good store easy assemble go wrong
1793,4.0,0,This bike is solid. The only thing is that ...,bike solid thing clicking sound rotation flywheel know product small defect bearing using spinning work well
1794,5.0,0,WONDERFUL SPIN BIKE!,love love love great bike similar identical gym quality spin quiet smooth take much room well made
1795,1.0,3,The bike was good until the left pedal flew off when I was ...,bike good left pedal flew pedaling causing bad bruise left leg examining pedal fixture cycle closely thread black extension rod cycle pedal worn numerous attempt fix back cycle failed unable reach sunny health fitness regarding wonder anyone similar issue fixed back pedal cycle
1796,5.0,0,Five Stars,great bike easy assemble
1797,5.0,1,Overall I think it bike is an excellent value. I did not have any of the ...,overall think excellent value damage arrival people mentioned ill see hold time continue recommend bike friend
1798,4.0,0,but other than that it is good value for the money,well constructed seat bit uncomfortable good value money
1799,4.0,0,easy to set,work described easy set
1800,5.0,0,easy to assemble,well packaged easy assemble working smoothly month issue
1801,5.0,0,Five Stars,great bike sturdy well made love
1802,5.0,1,great bike for price,well put together product described great price still using today awhile recommend good deal
1803,2.0,0,"Despite the glowing reviews, it has practical issues",thought due good review indoor cycle great became apparent first set rendered almost unusable live second floor walk noise generated bike make impractical basically sound brake getting stuck front wheel nothing touching easy adjust anything get bike seat move forward backward know thing sell craigslist meantime traded real gym membership
1804,5.0,2,I'm a avid bike rider and this stationary bike was ...,avid bike rider stationary bike everything hoped riding snow
1805,5.0,0,Great bike!,great bike well built definitely recommend reasonably priced bike
1806,5.0,0,Five Stars,great product
1807,4.0,0,Where do I get replacement brake pads?,easy assemble feel pretty sturdy yet find link order replacement brake pad yet know soon need knowing reassuring
1808,5.0,0,"Awesome for the price, highly recommend",well packaged incredibly easy put together little bit noisy riding isnt bad given price machine highly suggest cadence tracker go along
1809,1.0,0,"If you want quality, this is not it!",noisy seat stay still built someone foot
1810,5.0,2,"This bike gives me an excellent workout. I am 6'3"" 245 and it feels ...",bike give excellent workout feel great well made easy assemble
1811,3.0,0,Burning rubber smell,give bike star great bike price however burning rubber smell come bike resistance turned started first use someone know fix know normal please let know
1812,4.0,0,Love,use bike cardio verry similar professional dont break
1813,3.0,1,Three Stars,great bike squeak lot certain setting
1814,5.0,0,Very comfortable,smooth ride sound comfortable
1815,5.0,22,PERFECT for the price!,amazing got yesterday far happy easier thought put together made change addition bike loose chain tightened slightly added water bottle holder added ipad holder bought wahoo cadence tracker return purchase wireless see accurate swapped pedal spd pedal polar watch already measure calorie way bike still make little noise nothing crazy sound noisy schwinn almost bought spin class happy bought instead buying schwinn computer cart bike way positive review
1816,5.0,0,Perfectly Simple,bike perfectly simple un needed display gadget solid perfect bike tabata sprint use tabata timer phone bike hand brake stop instantly second rest period
1817,5.0,0,This is an awesome bike. It is tough and durable,awesome bike tough durable comparable bike local gym love
1818,5.0,3,NICE,nice bike ride great easy move wheel front read lot review purchased bike paid regret wish exercise thought bought lol
1819,4.0,2,It is a high quality bike.,given star seat need changed comfortable workout find adjusts fit need sturdy riding sitting standing look forward ride treadmill handle hold book kindle keep occupied exercising
1820,5.0,0,I am more motivated now that I have this equipment handy and ready to go.,great motivator workout still watch tv worry sitting nothing love
1821,5.0,0,"Solid product for the price. However, as others ...",solid product price however others pointed isquite noisy use
1822,4.0,0,Spin for the win,easy assemble well maneuver sturdy use meet expectation stationary bike complaint seat tad hard however find case stationary exercise bike
1823,5.0,6,"Rugged,low cost, no frills bike delivers as promised.",purchase customer service excellent well informed package arrived damage bike assembly easy nothing hardly nothing break great heavy difficult transport item worked advertised week use sturdy simple bike great use knee rehab high cadence low wheel resistance maybe later
1824,5.0,0,Five Stars,nice
1825,4.0,0,Solid spinning bike.,got bike month ago happy fairly easy assemble well designed however say thing bit iffy instance really need crank tension order simulate climb otherwise gear feel stand sucky overall get job done use mtb training
1826,5.0,0,Better then the cycling bikes at the gym,love bike far perfect cycling video cycling pace get gell seat cover make much comfortable
1827,2.0,0,Burnt smell and loud noise when resistance is increased,bought bike month bike emits strange burnt smell resistance increased loud sound accompanies smell well
1828,5.0,0,GOOD PRODUCT,good delivery easy install steady product fun use reccomended easy reposition seat need cusion
1829,3.0,3,Great value but be aware...,never spin class road bike road racer bought rehab knee surgery looking something sturdy reasonably priced relatively good review bike fit bill agree great value glowing star review reality others mentioned yes better taller yes seat comfortable require drilling adjustment hole handlebar adjustment height ride using lean forward road racing position uncomfortable course road racer simple design fix drill second set hole opposite side post reversible least give different position handlebar inch closer biggest problem encountered brake suddenly apply riding search review found others applied lubricant brake pad eliminate squeaking brake catching far worked see giving star something required break drill modify caused injury brake catching manufacturer easily made modification provided information
1830,4.0,0,Great home version of a spin class style bike,surprisingly solid price great home version spin class style nice easy adjust accommodate multiple user occasionally noticed bad smell pedaling hard resistance turned
1831,5.0,0,Great bike for the price,bike great price shipped time good condition ride almost everyday far held lb cycled spin bike none comfortable normal gym discouraged seat leave bit sore first bike designed mock real road bike give great thing miss bike trip computer
1832,5.0,0,Five Stars,awesome
1833,5.0,0,Great!!!,got wife work time love shes foot tall work great weigh pound wiggle sqeek sturdy bike great prize also
1834,5.0,1,Five Stars,great bike money love
1835,1.0,5,Broke in under a month,disappointed researched indoor bike week making purchase significant purchase dutifully read review comparison shop even debated getting peloton settled sunny seemed great deal bike came quickly love amazon surprisingly easy assemble excited part half marathon training program imagine surprise soft workout left pedal fell rendering totally useless shot mid make matter worse putting back impossible thrown window first thought maybe assemble correctly maybe problem know case assembled countless bicycle exercise equipment large small furniture kid toy exceptional attention detail take great care putting thing together read instruction meticulously screw tightened tested bike seemed solid instruction specifically mention careful installation pedal sure follow closely also cautious making sure use bike pedal backwards direction reviewer warned proud owner pedal dough useful cross training option believe well made quality item break easily utterly impossible fix used intended seem right mention dangerous standing pedal moment broke yet contacted company time sort thing recommend purchase hope review get lost sea high going keep trying fix perhaps someday free time give call please think twice taking kind trouble wasting money
1836,4.0,0,Great purchase,pedal smoothly run fairly quiet sturdy great value price need gel seat top hard bike seat also set easy quick spite instruction detailed
1837,5.0,0,Perfect!,bike exactly looking love make want exercise go ahead spray brake pad silicone spray setting upotherwise pad squeal little bit trouble handlebarstem fitting frame little handi work got put complaint work quiet put gel cover seat
1838,5.0,0,Love love love this buy,wanted cheap starter spin bike use home work great seat need adjusting often price problem
1839,4.0,0,"Good, but arrived slightly broken.",great bike part arrived broken need replacing annoying
1840,5.0,0,We love this! Very sturdy and looks great,love sturdy look great move room room pretty often wheel helpful highly recommend
1841,5.0,1,Value,good stable easy assemble well packaged good value
1842,5.0,0,Very nice and highly recommended,loved bike gym delighted find online easy assembly compact professional quality reasonable price handlebar nicely spaced speed regulation snap easy change height different peep cage pedal nice downside usual hard bike seat put pillow bob uncle
1843,4.0,1,Good but Uncomfortable Seat,seat uncomfortable good bike
1844,4.0,0,Overall it seems like a good piece of equipment,heavy slightly uncomfortable overall seems good piece equipment
1845,5.0,0,works great!,first bike machine ever owned work great
1846,3.0,1,pedal makes disturbing noise,left pedal make noise sound piece bending time put good amount force climb cheap aluminum used instead something flex much
1847,5.0,0,Pleased with my purchase!,pleased purchase cycle arrived time described easy assemble really glad bought instead expensive everything need room build strength lb flywheel
1848,5.0,0,I really enjoy this bike,really enjoy bike quiet downstairs neighbor appreciate lost little weight hope stay
1849,5.0,0,Great addition,basic job great price
1850,5.0,1,Worth the price!,great buy definitely worth price pretty easy assemble got great first cardio hour put together say play around seat handle bar height bad
1851,4.0,1,"Fair price, solid equipment!",happy product better health safe enviornment way
1852,5.0,0,Worth the money!,love
1853,5.0,1,Great workout!,spinner great beginner sturdy well built easy assemble give great workout purchased year old female tall sure spinner big fit perfectly also purchased beginner spinner dvd help keep going strong downfall water bottle holder bought store bike easily attached
1854,5.0,0,I would highly recommend this for your home,highly recommend home month work great great bike fast delivery
1855,5.0,0,Five Stars,sturdy easy assemble month complaint
1856,5.0,0,It's great!,bike everything expensive cycling bike former gym great
1857,1.0,12,Damaged,bike damage area see picture area already assembled supposed return thing weighs pound
1858,5.0,0,Sunny Health and Fitness Cycling BIke,happy purchase read review bought careful consideration review helpful found accurate handle bar bit wobbly buying new seat point overall gotten great work concerned minor imperfection bike changed mind purchasing price heavy sturdy
1859,4.0,0,Great!,long work great easy assemble wish monitor time mile
1860,5.0,0,Great value for the price.,completely happy purchase bike month riding consistently like seeing result want comfortable piece equipment slightly noisy nothing terrible great value say least
1861,5.0,0,Best value for the price,best value price use several time week short seat lowest setting fit perfectly wish handle bar moved forward price point complain
1862,5.0,0,Five Stars,nice bike
1863,4.0,0,Four Stars,work good make sure apply powder graphite brake stop noise
1864,1.0,44,Sunny Health & Fitness Pro Indoor Cycling Bike Review,bought bike april pedal right already broken warranty day wife ride standing maybe built deal type riding lb wife issue bike also noisy tried fixing issue yet seems adjustment fix issue buy product plan really heavy duty riding
1865,5.0,0,Great bike!,looked quite spin bike homework purchasing impressed fast delivered ease putting together overall quality bike price used time far little month love even downloaded cycle coach ipad class obsessed
1866,5.0,0,Great Spin Bike!!!,bike solid easy put together changed pedal quick
1867,5.0,0,Five Stars,thigh getting really big sure stop
1868,5.0,0,Five Stars,smooth quiet solid machine need computer knew start
1869,2.0,0,Cheap,ok hood
1870,5.0,0,Bike is stable while mounting,convenient well designed sturdy machine first purchase kind worked extremely well
1871,5.0,0,Five Stars,great bike price
1872,3.0,1,Three Stars,good price easy put together however squeak loudly annoyingly
1873,5.0,0,Great bike for the beginner.,perfect someone want good cardio price reasonable easy assemble
1874,4.0,0,"Sturdy and easy to put together, but vibrates quite a bit.",really ideal bike price complaint vibration come pedaling second floor house downstairs low hum someone riding obviously audible bike use headphone movie bother much looking spend professional cyclist good option keep home gym long continues function
1875,1.0,10,PIECE OF JUNK!,piece junk nd rd bike began making loud knocking noise mechanic take apart found front axle warped riding bearing ruined told sunny sent new axle new bearing put ride third ride making loud knocking noise quit riding obviously front frame warped matter many axle bearing put going get bend bearing get crushed buy
1876,4.0,2,"Good bike, Easy fix for brake pads squealing",pretty good heavy duty spinning bike squealed high brake tension sprayed side fly wheel teflon dry lube spray bike chain spray lube wiped paper towel problem solved still add plenty resistance bike lubrication
1877,4.0,0,Good deal for your buck,easy assemble use complaint seat comfortable
1878,1.0,0,Damaged.,soon open box damaged
1879,5.0,1,Five Stars,love light occupy much space
1880,5.0,0,well built!,excellent buy
1881,5.0,0,others might not be able to) and it works great. Looks like the picture,delivered front door assembled people others able work great look picture
1882,5.0,0,The best bike for the price,good fancy expensive bike great alternative exercise winter time go outside ride thing add bottle cage buy doubt
1883,5.0,0,Five Stars,love bike great product great price
1884,5.0,0,Five Stars,look cool solid design especially red
1885,5.0,0,Awesome Spin Cycle,awesome spin cycle cycle perfect option maintaining fit long cold winter extremely hot summer
1886,5.0,0,Easy to assemble and stable.,bike good used gym get clip pedal want really get adjusts easily remains secure
1887,4.0,0,"Great workout! Very sturdy, Can't beat the price.",issue bike way shipped box torn middle way packed un professional problem wanted send back impossible anyone know get speedometer bike please email thanks
1888,5.0,0,Extremely pleased!,received last weekend love review stated assembly difficult thirteen year old son put together minute much sturdier expected price paid far noise issue seem louder bike used gym recommend bike great value good product
1889,5.0,0,Great bike.,loving far well built sturdy
1890,5.0,1,Five Stars,
1891,5.0,0,Love this bike,spin cycling home much cheaper going gym love bike
1892,4.0,1,Great Bike,bought product jan th received feb rd took time put together love definitly expected gave star people seat hard changing handlebar little unsteady worth penny
1893,4.0,0,Great bike.. cosmetic issues scratched and red paint,item came scratched red paint located base disappointmenthowever bike great
1894,5.0,1,Battle tested!,thing make shift gym deployment impressed led get got back
1895,5.0,0,A nice home spinning bike,excellent bike money
1896,4.0,0,Four Stars,great spin bike stable heavy duty tip
1897,5.0,0,I missed a few days) but definitely an awesome purchase!,use daily least past month ok missed day definitely awesome purchase
1898,5.0,0,Five Stars,described
1899,5.0,0,Five Stars,really great price great bike
1900,5.0,0,Five Stars,easy put together resistance easily changed turn knob
1901,5.0,0,Five Stars,great bike seat hard rock replaced bike great quality
1902,5.0,0,Five Stars,beginner bike work well
1903,4.0,0,Solid bike,solid well designed product good add adapt electronics
1904,4.0,0,Four Stars,great bike seat go low enough foot frame
1905,5.0,1,Extremely solid bike for an incredible price! My daughter ...,extremely solid bike incredible price daughter live spin class tv love
1906,4.0,0,Great purchase,easy use
1907,4.0,0,I saw immediate results!,never avid spinner day buying using cycle dropped last pound love bike
1908,4.0,0,Four Stars,fan seat bike great
1909,5.0,0,I love this bike,love bike tired looking around gym brought home use bike almost everyday hour held nicely easy put together wish came petal spin shoe heart rate monitor small thing overall happy purchase recommend friend
1910,5.0,0,My wife is just starting out with spin class and this worked great.,solid cost wife starting spin class worked great
1911,5.0,0,Five Stars,ok nice bike price took min put together
1912,5.0,0,100% would recommend.,product arrived time advertised recommend
1913,5.0,1,Great bike for the money!,typically write review love bike much ft working mom yo always easy make house run walk getting gym impossible looking step cardio game opted bike much success ellipticals figured worth try using conjunction peloton love steam workout convenient dripping sweat time finished terribly noisy took box rode first time tell chain rubbing plastic guard fix tension flywheel quiet simply loosened bolt side flywheel pulled towards front bike tighten chain bolted back place minor mod included gel seat came brutal water bottle holder probably going add computer soon track cadence excellent buy
1914,5.0,0,Great bike,price well
1915,5.0,0,I love it,everything expected
1916,5.0,0,Five Stars,amazing bike price felt gym
1917,4.0,0,I really like this except the leather seat,really like leather seat month aleady leather seat pulled apart little
1918,5.0,0,Five Stars,work described look pictured
1919,5.0,1,Better than expected,read positive review several site purchasing receiving bike disappointed hardest part assembly removing bike box simple assemble bike sturdy price good purchase better expected
1920,4.0,0,Thomas,training
1921,5.0,0,Awesome bike,awesome bike want gym
1922,2.0,1,"Right pedal is bad, bearings are all jammed up won't spin freely",right pedal bad bearing jammed spin freely nd bought issue crank arm stripped worthless boat anchor
1923,5.0,0,Best Indoor Cycling Bike,shipping fast installation breeze bought mom dad love really brainer
1924,1.0,5,DO NOT BUY...4 MONTHS AFTER PURCHASE BIKE IS UNUSABLE,buy bought bike december based mostly positive review month later unusable pedal came lose reattach bike hole pedal screw bike stripped bike completely worthless metal bar hold pedal part overall frame bike not switched noticed reviewer issue addition many reviewer complain loud noise coming flywheel noise loud husband hear side house
1925,5.0,0,Five Stars,great
1926,5.0,0,"Great bike for any price, especially this one",study well made easy assemble seat great easy swap better worth look
1927,5.0,1,Solid Product,unbelievable value solid bike home use easy assemble
1928,5.0,0,reasonable price.,easy construct difficult move around light stationary bike
1929,5.0,13,Soul Cycke at Home,happy purchase warning box come extremely heavy take hour assemble tho bike sturdy bike gym actually not believe cheap sturdy small girl support well also purchased ipad holder heavy duty mat
1930,5.0,0,GREAT VALUE!!,pretty solid impressed far wife tried happy far
1931,5.0,0,Excellent  product,excellent product
1932,5.0,0,Great bike,great bike especially price solid build easy assemble arrived time box really heavy well packaged brake little noisy took little wd quiet thought original seat fine wife bought comfortable
1933,5.0,0,Five Stars,bike time week love
1934,5.0,0,Five Stars,great quality
1935,5.0,0,Amazing Indoor Cycle,needed new form cardio routine decided pay indoor cycle cheaper price work fabulously needed also shipped really fast making possible change routine fast overall perfect
1936,5.0,0,Five Stars,great product fast shipping
1937,4.0,0,simple but strong,like timer handle bar
1938,4.0,0,Love this product,realy get good workout great price product wish speedometer enable view distance rdp calorie etc
1939,5.0,0,"High quality, but noise?",great well built high quality thing make noise stop need oil tension break incredibly noisy depending much friction applied
1940,5.0,1,Great value for the money,money bike extremely well constructed happy purchase
1941,5.0,0,Wow!,amazing spinner believe get price great spinner go
1942,4.0,0,"because I am shorter than product is recommended for, but it would be SO nice if ...",mostly fault shorter product recommended nice included adjustable handlebar back front feel still pretty far keep mind shorter side bike include bottle holder cheap include get pretty cheap online bike really well built ride really good slight vibration noise higher speed good product overall
1943,5.0,0,Five Stars,great well made spin bike reasonable price go wrong
1944,5.0,1,Five Stars,great bike study
1945,2.0,0,excitement won't last,first month bike quiet hear sweat hit floor unfortunately month bike started making clunking noise disturbed everyone house contacted sunny given instruction trouble shooting learned service product texas warranty compare pro form spx almost identical ride pro form chain noise consistently used month problem bearing wore pro form actually stand product even warranty provided contact home repair service bottom line want spend bike run smoothly month tool time video troubleshoot email want learn keep operational bike
1946,5.0,0,easy to put together nice and stable well built only ...,easy put together nice stable well built wish speedo
1947,5.0,0,GREAT BIKE,great bike better price
1948,5.0,1,First spinning bike. I have used it for over ...,first spinning bike used month loving problem far ride minute week
1949,3.0,1,Works but not without some DYI fixing,bike give decent workout chain fallen packaging required taking whole thing apart fix difficult something expect new product right box nd bigger issue holding handle bar bike quite fit hole handle bar slightly wider hole neck bike gon need see amazon sunny h f something
1950,5.0,2,a year in and still going strong!!!!,year still going strong guy mainly lifted weight needed get little cardio workout use roughly time week rotating lower resistance speed high resistance training thing didnt seat found uncomfortable minute riding always try ride minute buy comfortable seat dollar well riding usually watching show listening album time reference pace however loud use headphone prepared turn tv stereo found case good stationary bike thing year tighten couple thing expended often use
1951,1.0,5,Hard seat and very small base. .,seat hard sit small comfortable unhappy purchase
1952,4.0,0,"Wife is happy, I'm happy",christmas gift wife assembly easy price sturdy comfortable lb flywheel allows great complaint minor tension change quickly turn dial squeaking high tension able eliminate overall great value
1953,5.0,1,"I've always hate bicycling, but this bike is perfect for my ...",new spin always hate bicycling bike perfect quiet easily adjustable
1954,5.0,0,Five Stars,love bike got adjusted right
