,star,helpful,title,text
285,5.0,1,Surpassed expectations!!!,love say little skeptical based price spin surpassed expectation say ordering bike get good seat thing bad bike ride smooth solid heart rate stuff others heart rate monitor fitbit better anyway basic knowledge tool use wrench allen wrench able put together easily worked bike tech year took longer get packaging actually get together ready ride
286,5.0,1,Absolutely LOVE my bike!!,heavy arrived took ups guy put door step unpack door step easy put together bad year old girl use daily wheel start squeaking sprayed wd perfect happy chose bike made purchase
287,2.0,1,Needs on going mma,run smooth however thing started come loose crank arm keep loosening due oil thread belt slip load even tightening cleaning q factor bike insanely wide uncomfortable time
288,5.0,0,Worth the money and very well made,excellent bike well made fast delivery shocked got soon perfect timing insane pandemic definitely changing seat seat came typical racing bike sooner later destroy prostate order old man bicycle seat nice timer handle bar nbd
289,5.0,5,Great spin bike!!!!,love spin believe inexpensive quality amazing spinning year gym used several different bike sunny bike hold bike even better ride smooth stable super easy put together well using month still awesome spin almost everyday still love
290,4.0,0,"Sturdy bike, great workout",great bike money good heavy wheel make smooth ride using daily week complaint resistance pad squeal riding seat typical uncomfortable seat pretty close find normal road bike get used bike sturdy ridden sitting standing flat full resistance done soul cycle style riding sway tilt move way make feel unsafe great workout bike
291,1.0,7,Poor Product/Poor Customer Service from Sunny Health and Fitness,reading review thought nice purchase wrong assembling easy product nicely built function well seems ride fine resistance added vibrates crazy feel floor room thought maybe got defective bike contacted sunny health fitness sending video told something hear see something feel care requested video anyway course replied video saying hear anything wrong bike duh already told something heard anyway go step attempt fix bike solution frustrated informed company buy new product fix use care contacted amazon instantly sent new bike shipping label send first back made happy kudos amazon assembled new bike problem apparently bike junk seems well made look nice not deal odd vibration come ridden many chain driven comparable gym function properly happy purchase sick assembling disassembling bike guess stuck
292,5.0,1,We LOVE this bike,love bike wish schedule mine got utilize amazing work bike arrived partially assembled much work easy put together clicking sound everyone else mention exist work either music tv bother u bike ability increase resistance boyfriend loved actual outdoor cyclist seat narrow bottom order wider comfortable seat woman probably short comfortable use bike first struggle find comfortable position allowed reach pettles seat lowered brought forward certain amount boyfriend issue beware heavy need hand truck something get overall love product
293,4.0,1,Awesome,really bike minor complaint seat sits far back ability move forward also small crack bike chain seat way hard buy comfortable seat replacement overall bike recommend purchasing bike need something house positive tool come bike took min put together
294,4.0,0,Two thumbs up,purchased recommendation friend really impressed easy assemble took minute suggest people solo slightly difficult instruction easy understand follow set hoped rode minute ride quiet thought
295,5.0,0,Solidly made,extremely well made solid worry tipping bit complex put together direction well written part well labeled riding several month happy seat softer delicate
296,5.0,0,"If You're Considering a Bike for Your Home, Just Buy it. It's Plenty Great and the Price is Spot on.",surprisingly quiet well made hear clicking odd sound chair area really issue sure way fix still x quieter home machine hard time adjusting bike height etc user switch back forth secure little secure unusually weak hand story assembly super easy sure complaint ever assembled flat packed furniture ikea plenty well equipped second set hand helpful done person recommendation get ahead assembly instruction u went crazy reading instruction going step step go back make adjustment nothing terrible product zealous assembler
297,5.0,0,"Overall, great quality, very smooth and quiet ride, and a killer price!",month research reading review finally decided bike budget time went store ask someone indook cycling regularly recommend something double budget paid find anything like price thing free shipping ups guy really heavy bike super easy assemble take minute look cool suprise quality sturdy quiet really quiet also surprise use use mi bike trainer really noisy probably important feature move bike time workout front computer really easy even younger son thanks couple wheel front base standing front bike pull handle back voila move everywhere stair course overall great quality smooth ride killer price
298,5.0,2,older rider,received item day took min unpack organize min assemble assemble take minute small woman year old far good ride today first time use spin dvd test ride course much smoother road bike trainer feel real buy dry silicone spray hand pad start make noise heavy machine feel sturdy standing climb adjustable size others said seat uncomfortable never met road bike seat get hope stay happy order
299,5.0,1,The ultimate Bang for your Buck,everything spinning bike solid look spin gym bike flywheel fraction cost live apartment building thin ceiling floor goal get something quiet bike completely quiet exercise machine surely quiet enough yes seat make bum hurt used go road bike style bike seat said already used hard road bike seat definitely get gel cover real complaint tension chain box quite tight enough giving tiniest bit play chain fully engaged peddling really noticeable peddling slower bike heavy pound incredibly surprisingly easy move around surely recommend bike anyone looking
300,5.0,2,"Good, sturdy, and comfortable bike! Great buy for the price!",researching indoor bike decided sunny instead schwin ic mainly price spend schwinn feel sunny good bike thecomputer display bottle holder bought separate computer received yet received day early thanks amazon able put together minute box came minor small hole part undamaged recommended people put together problem year old lb not run anymore bad foot wanted bike use everyday reviewer mentioned noise wheel crank resistance heard soft humming something rubbing wheel low deal breaker spray lubricant noise go away ordered oil spray get computer tomorrow concerned noise noise peddling barely noticeable sound even peddle hard bike feel sturdy comfortable even seat hard expecting based review gripe wish handle bar adjustable inch closer bar screwed give whole based use happy purchase recommend
301,4.0,2,Great Space Saver!,husband junked loud old treadmill decided get reading ton review set know hour complain said quite simple thing actually even smaller thought going great take fraction space treadmill give amazing workout really expect loved negative gotten bit louder past month nothing treadmill also wish see far gone nice deal electronics time easy adjust give plenty resistance completed half marathon minute bike wear higher resistance yet pounding leg agree great purchase
302,4.0,1,Noisy but works well,love work spinning class better side loud scraping noise difficult spin family watching tv goal biggie cut use half deducted star need soft seat cover handle bar forward tilted compared class ride break strong everything fully adjustable design limit
303,5.0,2,"Awesome bike, expertly packed and arrived quickly",awesome bike expertly packed arrived quickly apprehensive purchasing online fear return process need believe sturdy well made everything put saddle given bike buy saddle specific rider seat comfortable everyone messing around different adjustment seat handlebar finally found sweet spot pedal long want also super easy move around little wheel front happier bike still shock low price
304,5.0,0,Sunny - It's all good!,set straight forward sunny ride smooth tiny bit noise much even distraction bike set indoor trainer made lot noise also set cateye velo bicycle computer cc vl using instruction picture akirkfoto review comment change akirkfoto simply used factory computer setting already programmed thinking hybrid road ride ride exercise bike versus road hybrid different experience think sunny third bike primary thing cateye great data time bike record track overall happy performance sunny get fantastic workout
305,5.0,0,You won't find a better deal anywhere on an exercise bike,researched lot wanted alternative running treadmill winter month find better deal anywhere exercise bike frill tension manual knob connected wire close couple caliper wheel voila increased peddling difficulty seat actual bike seat get padded short want destroy posterior long bike quality professional grade mean well built know selling affordably also crazy easy move great inevitably becomes clothes hanger month care distance riding bike computer useful trying track distance calorie burned
306,5.0,0,"Excellent Bike, Especially for the Price",bought bike wife routinely attends spinning class love tried thought seat bit small told long sitting supposed stand peddle class easy build impressed easy move room front wheel still sits firmly floor quiet seems well built wife hit inner knee center brake handle first leaving small bruise adjusted seat back fixed problem wish handlebar shelf put mobile device music video peddle slimmer shape otherwise great price
307,5.0,1,A great value,using daily almost several month really like simple seat uncomfortable ride regular bike seat similar get used handle bar odd looking affords many different hand position nice seat handle bar many position easy adjustment size rider bike seems well built gadgetry look clock ride specified amount time
308,5.0,0,Very pleasantly surprised,want spend ton money stationary bike track record home exercise great knew bought piece junk reduce likelihood using much turn great deal bike really sturdy flywheel heavy riding smooth secure ride bike nowhere well worried come piece recently bought furniture ikea ever done know fear give take went together easily thing like see adjustable handle bar paid week later quick chat amazon difference refunded partly rarely shop anywhere else
309,1.0,2,HORRIBLE!!!,bike came broke extremely heavy help delivery guy come upstairs assembling saw came broke return waste time trust review
310,4.0,1,Nice Spin Bike,checked option find used spin bike top line new costing glad spend spin bike great job lot road riding weather nice looking something keep going weather great fairly big guy lb bike handle size problem part routine involves cranking resistance standing pounding pedal minute bike stable feel solid entire workout handlebar height seatpost height seat position front back easily adjusted weakness pedal old style toe strap bit pain get tennis shoe locked handed operation also experienced chatter resistance pad others mentioned put dry graphite lubricant yet cure understand positive bike delivered quickly easy put together problem
311,5.0,1,Great bike for the price!,assembly easy took longer unpack assemble quality impressive price feel last long time adjust positioning nearly component fit wide variety people riding style gripe wish free wheeled stopped pedaling bike manage note basic unit kind computer others purchased computer intend install require little modification
312,5.0,1,Absolutely fantastic replacement for road riding,absolutely fantastic replacement road riding realistic road feel heavy flywheel change recommend crank arm slightly farther apart q factor road bike took little adjusting road shoe cleat get right pulled heel slightly nice switch crank something closer road everything bike steller
313,5.0,0,Great Value With One Exception,quite pleased purchase especially price point assembly ultra simple bike ride sturdily moved pad contact carpet simply put scrap cardboard pad protect carpet past exercise equipment left black mark come single big gripe water bottle holder even pre drilled hole mount cheap water bottle holder cost drilling couple hole cost even le working hard spin bike need water going give star major oversight given price drill hole spend couple buck holder
314,3.0,1,Quality product... Only issue is with the seat.,happy product far seems quality product installation easy able get running minute biggest issue product not seem get seat bike stay place tighten seat tight possible minute riding bike seat want push backwards cause great discomfort bottom cause stop riding ordered seat cushion go factory seat wife complained discomfort order whole seat replace factory
315,5.0,0,Just what I wanted,loved spinning class gym wake make time filled fast wake work house shower home dream come true bike good quality heavy fly wheel easy increase intensity assembly pretty easy keep track time take long note like point seat assembly explained properly seat need adjusted support weight angle set seat make painful creating pressure point hurt really bad adjust angle like point seat supposed comfortable stationary bike yes spin bike get used give time bike sore first week drink holder use waterbottle holder strap hiking come something
316,1.0,1,Bike pedal stripped after 6months!,purchased bike buying gift grandpa immediately loved worked well simple put together great machine home exercise owning month using twice week twenty minute sad report bike pedal came riding attempted screw back threading appears stripped way fixing bike attempt contact manufacturer see anything done think moderate use month bike useless hope sunny health fitness help update fixed
317,5.0,0,Buy it. it's worth it.,update mar still wonderful update yr later still going strong issue love bike sturdy nicely made feel bike find high end gym happy changed pedal spin shoe work charm using regularly held well spinning cycling year put bike ever ridden wish bottle holder deal breaker
318,5.0,0,Really a super bike for the money. One at the home & one at the office.,really enjoying bike replaced hip always needing keep muscle exercised basic spin bike saddle adjusts height horizontal position help get best comfortable zone ride electronics mess great portable table stand ipad sits perfectly crook handle bar read watch something ride wheel easy adjust minor turn add real resistance took minute put together front wheel line skate wheel easy move saddle really tight move see move available position height adjustment using clamp closure rather hole drilled post hey week combined regular gym routine slow running routine getting stronger son used train half iron man race california extremely helpful cold winter day wet summer day
319,5.0,2,Great Value,good bike full resistance expected style bike definitely buy survived year almost daily use sign major wear
320,4.0,1,Fairly easy to set up,fairly easy set sturdy look great take bit work get adjusted height bet inherent spin bike wish foot holder pedal little le clunky tighten able add water bottle holder tablet holder handlebar seat bit tough end getting seat cover cushion ride
321,4.0,0,"I like it, but where are the parts?",overall happy however easily confused direction good vague confusing also putting last part bike handle bar realize missing screw washer hardware show picture everything piece top picture clearly never added amazon wanted get whole brand new bike sounded horrible idea box heavy take discount opted discount found screw homedepot happily riding thankful discount
322,5.0,2,Hard to Beat,avid cyclist year often problem keeping good record stationary ride paid extra bike fancy computer nothing agrivation trying upload strava bike set garmin spare garmin speed sensor great thing bike flywheel find much closer real riding expensive magnetic hydraulic trainer rock solid
323,3.0,4,"Good bike, horrible seat",purchased bike week ago got chance use vacation feel good feel decently sturdy quiet main complaint seat wont tighten turn pedaling trying stand climb turn completely side tried tightening wont stay tilt super annoying fully concentrate time try sit almost fell realized happening instead focusing ride strength focus seat turning back forth first put popped right landed floor sat im lb average sized female dont feel enough send whole bike back calling see replacement part figuring way rig
324,1.0,1,Terrible quality,break soon brokenand even warranty seller still tell buy part
325,4.0,1,Effective product at this price point,let start caveat fair amount experience indoor cycling first real experience spinner said think good product considering paid bike happy positive side stand long regular period abuse well riding several hour week winter held well thus far bike also particularly large heavy even able carry basement bit awkward still tuck corner family room much bother resistance quite variable easy set dial front bike everything also adjustable not imagine many people find workable fit best feature spinner much much quieter trainer set purchasing bike perfect important issue wheel brake squeak silicone lube seat post little wobbly squeaky well particularly really pushing tempo handlebar rather uncomfortable received road rash style burn forearm first long ride handlebar tape something need anyway take care issue finally think pedal bit wide something wear hour whole bike good product better expected price paid
326,4.0,4,"Solid Machine, Excellent Bargain",road biker bought indoor training experience spin bike spin class review standpoint cyclist price machine everything ask extremely easy assemble issue part fitting together others experienced look high quality part even available bargain price free shipping took week thanks amazon high quality thing detect separate machine cost twice price minor seems higher priced bike fore aft handlebar position adjustment adjustment size adjustment position coarse seat seat fore aft handlebar inch setting make difficult fine tune overly noisy operate quieter crank bearing totally smooth get used lack smoothness highly recommend sturdy looking basic spinning machine great price
327,5.0,1,Spinning at home whenever you want,using month certainly love steady stand sprint fairly quiet comfortable seat bothered le gym case spinning bike sitting working wish bottle holder easily added display gym rpm hr heart rate watch put handlebar get need knowing optimal training zone great spinning video online spin home rather catch decent class gym definitely becoming trimmer healthier quality seems good knob adjustment responsive notice real difference bike used different gym
328,2.0,1,Loud and inconsistent resistance.,really disappointed bike wishing splurged bit nicer resistance incredibly inconsistent fluctuates difficulty consistently use even adjust resistance additionally bike extremely loud squeaky apply wd time use get noise level manageable volume buy
329,5.0,3,A little bit noisy and not for short people,great bike amazing value took minute put together review find damage shipping box package contains nut bolt terrible ripped shipping result find piece end missing washer also similar experience short purchaser barely fit bike recommend bike even little bit shorter able reduce noise lube chain rattle remain overall great bike missing water bottle holder big deal home tricked spd pedal nashbar reader rack put ipad reader rack purchased video ride various location world ipad
330,4.0,1,"Very good bike, solid construction",good bike solid construction take hour put together hard size bike great wife negative bike good place rest elbow riding seated bent forward hand inner outer forward grip handlebar pretty far forward upright bike ridden regret buying attachment get elbow rest buy said none stop wife using bike exercise chillin
331,5.0,0,So easy to assemble a single mom can do it!,bike pretty much came assembled big girl bike hold weight pound go hard bike well built sturdy glad purchased bike better bike gym
332,5.0,0,Quality and smooth operation at low cost,ok waited year write review first bike simple assemble second bike slight vibration noise resistance braking system big deal third bike smooth rode minute day week year absolutely issue ride today day buy better stationary bike probably added monitor holder handle bar water bottle holder front fork piece equipment need take care lube chain quality lube check bolt connection periodically heavy duty solid hesitate buy
333,5.0,1,Very Impressed!,review said shipping box hole nothing missing bent scratched put together direction clear tool hardware included great however heavy bike lb female needed little help getting thing box standing used belong gym schwinn spin favorite cardio equipment never imagined expect quality home price difference expensive schwinn bike schwinn water bottle holder shipping super quick day free never write review feel product deserves havent bike long love far noise issue pedal problem movement handlebar seat stable feeling order water bottle holder im fine adding complaint far purchase im going give time buy second daughter husband use spin
334,5.0,0,"Easy to assemble, good quality",skeptical get decent spinning bike reading many review decided go happy sturdy easy assemble heavy recommend people get box place want taller good cycle handle bar set really low even highest setting find low easy adjust resistance riding give solid workout chain assembly little noisy tv ipod wont hear much complaint cycle seat omg torture went recommendation got schwinn top cruiser bicycle seat suck hard rock looking comfortable seat cycle standard seat normal bike easy enough swap great bike home workout well worth price come mostly assembled took minute completely assemble assemble want used wheel front move work well find better model price paid new model amazon com
335,5.0,0,Great product,free day shipping beat received item good condition box bit dented packaged tight everything good go took minute put extra part together review say handle bar bit shaky use effect use bike fact noticed even great expensive bike problem review said got new pedal pedal worked fine water bottle holder hindered ability drink water scoot side table next bike side handle bar eventually make hand hurt holding seat get bit hard flat riding minor issue great bike price oh looking wheel keep rotating even stop pedaling well took getting used still great spinning bike
336,2.0,0,COULD be a great bike,bike nice break pad come un oiled ride straight box get burning smell super whiny break customer service responsive everything say try involves using force video tried using much force take break yet completely stuck groove break get misaligned well make think someone forced together producing bike high quality bike super great little care put manufacturing
337,5.0,1,A great deal for the price,purchased spin cycle based number positive review say great value arrived assembled assembly support foot seat post saddle handlebar stem pedal minute good go noticed review stating loud chain rubbed hear slight rub spot pedal stroke loosened nut flywheel gave slight pull tighten chain le mm bike dead silent mean quieter road bike saddle leaf little desired prefer true road saddle flat narrow padding spending hour saddle far performance equivalent model found gym fact showed co worker picture said exactly gym load rock solid part wiggling rocking obviously model neat feature hard pressed justify extra expense model
338,5.0,1,Love it,added exercise routine thirty minute longer nightly streaming old movie week feel stronger fitter even already pilate twice week weight twice week year machine easy assemble fairly quiet adjust husband frame frame matter second wish easily add cadence monitor fuss tied monitor frame rigged get cadence awkward nevertheless price bike success world domination
339,4.0,0,Quality bike for a very reasonable price,great value price using couple week issue needed buy accessory track cadence worry care see side note pad probably need oil first use notice note went looking oil trick try riding first
340,5.0,0,"Great price, easy assembly, smooth",ordered monday shipped pretty much straight away ups service delayed time instead getting friday supposed come monday got delayed wednesday fault bike came took minute put together instruction pretty much simple straight forward try spin noise loose part moving stated customer review real trail come next week start riding hard nice bike price ft pretty nice comfortable well saddle minute yet see
341,4.0,2,Good value for the money,bike solid frame sturdy flywheel smooth heavy ride well current gym easier put together took longer get box put together packaging tight chance anything shifted shipping frame size good height little distance seat handlebar nice really problem bike chain rattle chain guard seat hard ended removing outside chain guard minute job provided assembly tool getting gel seat solved problem also switched toe cage pedal clip pedal personally find toe cage annoying general overall satisfied purchase good value money
342,5.0,0,Great bike for the hot summer!,got pretty active mountain bikers live az need something hot summer day make outside play bike super sturdy read consumer report recommendation review husband worried fit put together really quickly said really sturdy compact take much le room trainer make much noise something wrong people complained also put pedal ridden much yet return add review anything change far love especially price
