,star,helpful,title,text
0,5.0,488,Items needed to create a pton hack,ok kept searching review figure needed create cheap version pton trial error found see pic item bike great take minute put together even yo trying help heavy take people bring house package exterior came damaged interior fine waste money assembly racer work save hack pedal first bought amazon venzo work bike doctor match thread spd pic find online work also come clip shoe happy spinning
1,5.0,"1,892",Review After Year One,update post originally purchased bike june bit concerned low price intention use fitness facility bike rock solid purchasing month bike used spin class daily everyone small uber fit petite woman hulking lb men get hour hour use week recommended bike associate opening fitness facility purchasing high end equipment well known gym equipment provider asked bike showed amazon link sent dumbfounded said quite impressive feature especially bike inexpensive appeared good bargain actually computer went next day researched said quite impressed fact lowest priced bit reassured u made great choice even used parking lot special event problem bike screw tension knob bolt became bit stripped order issue brake squeaking month happen oil flywheel periodically brake get dried bit treadmill oil flywheel fixed immediately service bike bi weekly involves tightening bolt seat make sure stay put check bolt moveable part keep mind bike get literally hundred hour month minuscule amount service wonderful looking cost effective dependable bike definitely consider purchasing absolutely worth proslow costvery easy assemblysturdy solid constructionminimal maintenance neededvery easy move move puppy lot even shipping quick cheap yay prime consthe brake squeak bit resolved oiling flywheel periodically spin bike make sure tension released riding ensure dry bit squeak
2,4.0,590,Good bike for the price.  Just do a little regular upkeep on it.,little maintenance bought sunny spin bike late september use time week quite vigorously couple tip former bike mechanic spinning instructor help extend life bike lubricate friction point include brake cable insert brake arm mount bolt screw tension knob thread tri flow lubricant prior riding periodically thereafter mine month use bike grease slider component seat post handlebar insert saddle insert make easy adjust prevent seizing check torque bolt screw use driver tension wrench barring socket wrench appropriate metric socket allen socket refer sunny customer support torque spec comfortable feel basically want play pedal arm looseness torque matter bolt screw grease pedal thread prior installing spds regular pedal overtighten pedal solidly use pedal wrench least good box wrench give balanced tightening really overdo crank arm easily strippable grab crank arm pull side side check play flip dust cap tighten crank arm socket manufacturer spec know spec check c worked torque bit time play gone lubricate felt brake pad silicon based lube periodically mine week wipe flywheel use lubricate chain bike yet think probably good idea taken chain guard yet check tightness knob screw bolt regularly tighten lube necessary take tension flywheel ride short take care regular light maintenance fine
3,1.0,902,Completely broke at 4 months!,initially purchased bike absolutely loved easy assemble novice small footprint importantly used daily set ipad watch spin video added odometer measure distance speed perfect unfortunately month banging clicking nose started pedal come go month owning bike pedal snapped crank metal literally sheered half part bike assemble came pre constructed frame unfortunately engaging aggressive climb time nearly smashed face handle bar reviewed order amazon com website bike frame year warranty crank part frame came pre assembled reached sunny health fitness indicating happened reminding warrantee offered quote price crank considered part frame bike usable imagine paying additional part somehow disassembling frame replacing crank tool initially provided bike guess get pay take caution buying bike company poor customer service honor warranty unfortunate consumer quality product low
4,1.0,185,DO NOT BUY THIS CYCLE!,purchased cycle year warranty package assembly cycle assembled professionally assembler noticed clunking grinding noise pedal said product defective not fix nice stayed extra hour trying resolve issue amazon amazon wanted pay additional fee disassembly assembly purchase hour talking different people amazon informed sunny health fitness return policy even purchased year warranty refunded told stuck defective cycle looking cycle second time noticed new sunny health fitness claim pedal deflector left side crushed scuff wear tear
5,1.0,126,"Was great for one year and then it broke, broke, and broke again",first time done review felt strongly say something fist weigh lb foot tall decent physical shape bought year ago great lost lb month kept year later problem started first crankshaft sheared riding bike week later pedal sheared crank arm week hear creaking noise bike find crack weld front lower bracket ground bought bike great well dollar part mention lost work time time invest performing repair sell next broken part part bill keep getting higher wish bought perhaps competitor bike possibly higher weight rating even weigh bike rated
6,4.0,93,Not for Short/Petite People. Will cause knee pain!,really bike using week using least time week put laptop handle watch spin video youtube resistance make workout challenging thus making heart rate go way love problem seat not go lower pretty short stand sister going spin class year warned likely injure knee proper fit bike peddle right never knee pain entire life year old knee hurting past day stop using wish return bike however like know sunny health fitness make seat go lower special pedal short people taller shorter recommend bike
7,5.0,21,"Nice bike, pretty simple assembly",falling love cycling gym looking bike use home found feature wanted even review time bought handy strong worried assembling hardest part assembly getting box house basement box heavy lb surprised well put together easy assembly real issue assembling impressed instruction well thought clear walk throughs youtube similar sunny bike get stuck used time far difficult recorded spin class tablet use lowest height setting sturdy far stand sit feeling wobbly love monitor show rpm feature many bike seem tablet fit perfectly worry falling water easy grab cycling belt drive quiet far resistance work well caged pedal fit sneaker snug cycling shoe issue notice padding handlebar ripped shipment bit upset saw worried get worse padding fall also pulse hand monitor slow time tried actually get correct heart rate big deal use different device check heart rate something consider suggest buying bike plan getting small weight personal mentioned add ons weight tablet feel similar set much expensive bike much reasonable price update anything change
8,3.0,14,Pain in the butt!,good super sturdy lb lb flywheel popup adjustment knob inseam work short people attractive designthe bad absolutely useless monitor sunny monitor computer sure computes exactly model sunny machine pulse reader random ultimately work numeric reference resistance dial worst possible seat everi week tried make seat work got gel seat cover hoping work cover made thing little better biking min butt genitals uncomfortable seat unnatural inward arch lb sure much junk got pack trunk proper protection lady part bike also proper monitor important medical problem stationary bike actual physical therapy device proper resistance reference speed distance not track progress regression today technology sunny provide better monitor skip nonworking pulse reader actual speedometer odometer anyway saved box scheduled ups take bike back came well amazon think ups drive china
9,1.0,22,Waste of money,bike ish month great used spin studio nice leave home said issue brake pad shredding folding even low resistance feel cranked pad folding update opened claim sent replacement pad lasted week started issue customer service never replied initial question make sure happen purchase new pad buy new pad month buying bike tell keep issue happening care money preventative care maintenance cost consumer update pedal snapped morning workout buying product customer service terrible
10,1.0,53,"Defective Product, Buyer Beware",bought bike different location purchased almost new private person worked well inexpensive recommended online new bike defective day knocking sound pedaling standing position company solution type problem provide generic diagnosis picture video well email support people mostly generic unhelpful replacement part consumer feel confident enough proper tool time energy space perform job seemed job trained bicycle mechanic problem several suggesting sunny field service technician refer basically brand new product defective reached point zero confidence suggesting felt probably make thing worse trying fix time amazon exchange period credit card company return money product defect taken company qualify cc refund future never buy product kind professional field support repair save end worth
11,5.0,"1,627",Rock Solid! Amazing Value! I Love it!,update dec th sunny year use quite vigorously tabata drill holding great anything yet still new amazed bargain low price see cheap spin bike local walmart look half falling apart sitting display platform dnow back original review going divide review section convenience address bike reviewer comment little something spinning general first little recreational cyclist log year road bike purchased spin bike stay fit winter due weather limited hour daylight get ride road bike often prior getting spin bike day never spin exercise bike life bike amazed quality spin bike low price looked number spin bike b store even cost substantially good better simplicity assemble eventually post note comment section review assemble mechanically challenged manual come bike helpful anyone need use beauty easy assemble child instruction bike lb flywheel lot expensive bike lesser flywheel heavy flywheel make difference smoothness real bike feel ability give good workout even working little resistance bike rock solid weigh lb thrash stand pedal worry quality fit finish excellent even look great wanted mechanically simple bike ensure durability reliability bike fit bill perfectly resistance provided simple knob actuates brake caliper short cable cause felt brake pad side flywheel move towards flywheel away simple sturdy chain drive mean thing last forever electronically controlled switch servo malfunction much expensive bike also crank arm pedal mounted regular bicycle type arm plenty strong many bike price range often cheesy thin metal rod crank pedal standard issue platform rat trap type plastic toe clip pedal plenty sturdy work fine bike easy move grab handlebar tilt forward easy balanced weight flywheel help essentially lifting lighter rear end roll wheel everything bike sturdy adjustment quick easy grow bike beginner allow toughest take give much prefer bike trainer much sturdier hassle associated attaching real bike looking bell whistle e fancy electronics display bike want need thing recommend get get real heart rate monitor cycling computer electronic gadgetry even expensive fancy spinning bike always woefully inaccurate anyway bottom line want durable sturdy bike take throw go wrong sunny get better deal reviewer concern believe others giving bike le star address concern first seems anything especially large heavy thing require assembly always end getting bad review simply mechanically challenged type assemble properly even assembly extremely simple reviewer mentioned left pedal flying well keep mind real bicycle left crank pedal thread reverse threaded tighten turning conterclockwise trying force normally threaded strip thread probably tighten pedal sufficiently see complaining seat spend lot time real spinning take time get used sitting bike saddle also go buy thousand dollar road bike guess going come crappy saddle fact people different seat comfortable everyone manufacturer kind bike tend put cheap seat keep price low vast majority rider replace seat personal liking sense putting brook saddle bike thereby raising price substantially still liking many buyer said seat sunny bad using stock seat little uncomfortable first time got used reviewer suggesting getting wider heavily padded seat extremely obese huge rear end thing come bicycle seat narrower better minimal padding wide heavily padded seat seem comfortable first result chafing spend time bike anything seat sunny wide tad much padding k best bet wear cheap pair standard road cycling short bike chamois padding crotch see guy riding twelve dollar venges also seat require break time give time mentioned various noise bike quiet silent bushing front axle make little rattling sound especially really cranking problem anything chain drive make little sound chain silent also keep mind chain stretch sometimes properly tensioned factory mean simply need adjust chain tension need break time even quiet first regular maintenance anything chain post comment section mention manual manufacturer avert lot problem manual better written thorough exact bike nordictrack gx sport bike lot others cost money paying name case cheap plastic water bottle holder valid point others made bike probably suitable short people due fact provision bring handlebar closer seat short intent getting bike problem easily rectified anyone welder adjustment seat height easily accommodate spinning general hesitant buy bike thought find boring never use hate exercise exercise sake never catch gym needed way insure keep fitness winter ride road bike much well let tell love spinning download spinning mp class amazon rhythm ride coached cycling workout music mix advanced high intensity interval training hiit fitness instructor paul katami cycleology coached cycling workout music mix interval based ride fitness instructor kristen james time fly get great workout sweat riding f room riding road bike put mat bike floor get wet sweat beauty took road bike spin yesterday session sunny performance road noticeably improved mph faster best previous time good wind blowing le amazing interesting thing noticed spinning bike leg seem get better workout real bike live hilly area riding road bike make breathe harder get good cardio spin bike make breathe pretty hard cyclist enjoy spinning suggest also give real cycling try activity really compliment enahance real bike get enjoy scenery make friend loose dog enjoy weather traveling many mile get coast money well spent glad bought spin oh even came mile away free shipping fast ordered monday came following monday arrived damage think qualifies best purchase p thing seat seat level understand level type seat mean front seat sticking somewhat making look seat actually slanted bit find seat uncomfortable try adjusting position way meant well cure problem
12,1.0,35,Horrendous Product! Whistles and squeals non stop,great price easy setup tighten resistance knob squeak non stop someone whistle ear entire time pedaling squealing noise loud hear even wearing headphone mind sound freight train squealing brake screeching ear nonstop bike hoping find solution issue returning
13,1.0,44,I put it together pretty easily except for the seat,right working u put together pretty easily seat seat defective purchase far company helped u seat bike useless tried fix successful expensive time consuming disappointment change review company turn help defective seat
14,5.0,8,Who needs a Peloton,far good year old female needed help getting room wanted pretty much well together couple colorful word done hour half took time read instruction carefully change thing steal thing problem read direction took time right pedal hard time screwing something definitely right took extra wrenching take put time want crank way eventually got assembled breeze man needed put thing together lol see long last update review issue thanks amazon sunny fitness bike need peloton bad post picture review sure update week figured leave update loving bike awesome seen review water bottle holder calorie counter looking fancy schmancy bike go buy peloton read information purchase worry many calorie burning get ride fun anyway real biker mean biking need calorie counter fun found spin class find something else liked even better garmin make ton video someone actually biking gopro helmet italian alp german countryside england hawaii wherever want go actually feel real bike ride approximately week love lost lb put covid lockdown athletic person ride bike go gym time week happening found new love life sunny
15,4.0,18,"The good, the bad and the great. Amazon has your back!",good bad great quick guide save time read review prior buying good exceptional quality bicycle sturdy made quality metal function desired sweating time super easy assemble review claim otherwise look people screw assemble bicycle picture illustrating get caught guide mechanical terminology screw number guide follow common sense kiss keep simple stupid refer picture minute assembly short attention span bad item damaged shipping side cover cracked see photo fear amazon amazon made right resolved issue day great price extrodanary get shipping find equivalent bicycle price point cycle get price far inferior amazon worried damage amazon best company world opinion amazon supporter multiple year company appreciate long term investment value business fix issue make happy thus continue support overtime jeff bezos proud customer service consistently received year
16,2.0,23,Sturdy but clicking noise. AND terrible service.,sturdy enough seems good quality price however others stated annoying clicking sound coming right wheel spindle make unusable concerned riding make worse serious damage wrote company couple day sent back busy respond time email suck try adjusting wheel suggested work star rating cant believe customer service number call guess reviewer customer service department thanks help well update finally got email telling send recording sound went better rook chain guard rotated wheel sent video audio still waiting diagnosis fix hopefully ride
17,5.0,8,"A good, sturdy bike that fits me",bike month satisfied sturdy well built using day week minute day probably work hour day first stationary bike fact indoor exercise equipment ever used owned good health become concerned getting enough exercise bought bike researching little internet tall inseam long wanted make sure got bike fit bike seat adjusted setting maximum fit fine easy put together kind mechanical klutz really really mechanical klutz see reason pay expert assembly amazon offer already assembled put handlebar assembly seat seat post assembly front rear cross piece floor stand got chain instead belt sf b v sf b b think le time important thing note people view negative turn chain need weekly oiling according manual guess need oiling quite often use bike much heavily apparently way take plastic chain cover screw hold together chain sprocket wheel hard took minute shorter piece cover front attached outer piece fall take little bit dexterity get repositioned put cover back chain said kind mechanical klutz also manual say resistance pad need weekly lubricating silicone based spray lubricant start squeaking kind messy first time thought take pad completely pretty difficult spraying rim pad assembly lubricant drip rim flywheel hold paper towel pad wipe rim make sure something covering floor
18,3.0,14,"Sturdy, but...",pro cost cheap b quality build even low pricec lb flywheel make fairly smooth cyclingthe con packaging terrible double corrugated box weak delivered barely held together lb metal styrofoam packaging material box hold part place strapping also broken b handlebar horizontal adjustment getting proper form difficult muster c need tuned minor rattling noise vibration even low speed usually mean alignment issue possibly issue minor wobble flywheel spinning get started included saddle e felt resistance brake dial resistance smooth hoped
19,3.0,4,well made but some annoying ergonomic issues,firstly missing part installation essential sunny say ship part soon go together pretty quickly using week couple ergonomic issue annoying firstly handle bar small diameter making uncomfortable probably wrap padding handle bar tape new product small display not seen standing close hr readout take long time get accurate reading ok always keep hand position make useless scroll entire menu want change display cadence use chest strap hr monitor keep display cadence claim size fit height little optimistic saddle post almost way back issue someone plenty height left shorter problem lot room move resistance method flywheel side caliper type bicycle break adjustment sensitive fine tuning possible mine make whining noise certain condition shame bike quiet belt drive bad bike decent value money little attention detail made big difference
20,4.0,29,"Great bike, but needed some tweaking",new spin wife veteran love bike heavy weight focused front wheel really surprising heavy front wheel first time tried lift thought lifting thor hammer none problem bike want come almost fully assembled includes tool need put together nice issue ran chain making loud clanking sound peddling sort sound rollercoster make pulled summit noticed reviewer issue chain loose opposite chain tight remove screw holding plastic chain guard front wheel immediately obvious separate smaller piece give access bolt control chain tension also loosened bolt holding wheel slide freely adjusting bolt control far wheel move back forth little bit clearer open struggled bit figured much much smoother quieter
21,5.0,7,Great basic bike!,spent several week researching first stationary bike purchase reading amazon review writing week successful ownership phenomenal gadget gizmo flywheel peloton good solid basic frill work machine caveat remotely spatial mechanical took hour build bike enclosed direction full understanding bike work mechanical person likely put together half time bought gel seat sit atop included highly recommend fact slide arm rest shorter distance tad frustrating requires longer reach staying lower bike aspect bike good height comment tall people people reach top shelf particularly comfortable bike keep mind bike price gel seat supermat heavy duty protect floor also highly recommend thrilled purchase
22,5.0,7,Excellent Spin Bike (w/ a DIY Bike Computer),excellent exercise bike beginner wanted something quality ride work wonderful watched video proper spin bike position first ride march really screwed knee still recovering bike set staying saddle riding still get really good cardio bike great adjustable resistance took advise various review thought share set added bike computer added fleece wrap peddle hair tie use peddle injury son case fall put towel top handle bar hold water bottle kindle paperwhite separate hand towel whip away sweat eventually get water bottle tablet holder work well staying saddle added bike computer ebay sell model amazon went model bike computer magnet compatible modification needed done take exacto knife cut part plastic magnet piece unscrewing make flush used velcro thin tie instead tie secure wire bike provided zip tie secure bike computer handle bar magnet aligned correctly wheel used hot glue gun attach please see pic set bike computer set wheel size setting convert mm find pretty right accuracy comparing weight minute biked speed distance online calculator obtain calorie burned v assumed burning session knowing distance speed going know cadence pedaling rate find set sufficient helpful beginner cycling especially want way get cardio day overall opinion bike already used far nordictrack act compact elliptical longer made foot hurt glad decided buy bike
23,1.0,34,It started off great until....,even month pedal break completely never get pay also bother getting smart guard coverage week still heard anyone come repair waste money always enjoyable experience amazon maybe stay away exercise equipment
24,4.0,5,Great bike for price,job want wanted bike use peloton app range get noisy resistance increase use headphone block noise helped choose others rpm many others use cadence measure overall satisfied purchase well
25,2.0,3,Disappointed/ vibrations throughout the bike,terribly disappointed product good review high hope hoping company help said swap different return first pro put bikeeasy wheel aroundcon terrible vibration clicking right awaytook forever hear back company took calling found others answer section review also problem talked tightening chain finally got ahold someone sent trouble shooting section friend tried everything nothing fixed see hear back go returning small package report back get chain version spend extra money belt
26,3.0,4,Works but smell and rust are a concern,spin bike mainly used winter work seems decent value using cateye cycling computer get cadence get decent workout issue ergonomics ride normal bike expect much price couple point concern smell pad biggest definitely smell material workout bit concerned safe stuff breathe lever screw bolt splash zone started rusting fairly quickly even wiped tension cable tend vibrate certain tension making fairly loud sound seem able adjust height resistance pad wearing somewhat l shape
