,star,helpful,title,text
763,5.0,6,LOVE this bike!,normally use bike gym wanted something use home early morning late night tired drive gym bike gym cost k willing spend much saw review optimistic however expecting bike much even smoother gym steady easily adjustable look great thoroughly impressed took le hour put together need people move box highly recommend bike
764,4.0,0,Pretty good for the money,easy assemble seat uncomfortable replaced padded seat schwinn little shaky riding terribly distracting use minute warm garage weight lifting resistance generated pad flywheel go non existant difficult short twist knob nice handlebar adjusted horizontally vertically money suit purpose fine
765,5.0,2,easy to understand instructions for minimal assembly,package came quickly day order placed extremely heavy require team lift come detailed easy understand instruction minimal assembly seat handlebar lowest level still fit comfortably happy purchase
766,5.0,0,"Good workout, great price.  Easy to Assemble.",least mechanically inclined people find put together le hour minimum confusion frustration let fear able put together hold machine extremely quiet stable resistance smooth ample plenty hand position seated standing riding indoor exercise equipment boredom biggest issue bike limit
767,5.0,0,Nice features at a fraction of the cost,practical unit meet people need breaking bank adjustable frame
768,4.0,0,Bike,really bike heavy duty noticed knee hurt order bike make sure order new seat seat small hard
769,5.0,1,Very sturdy bike!,took awhile set together bike well made sturdy problem seat comfy buy padded seat cover set
770,5.0,0,Fabulous home spinning cycle!,love bike came quickly easy put together offer sturdy ride slick design highly recommend going back club
771,5.0,0,As good as gym quality,purchased use day able go cycling class gym instead ended using even able go gym sturdy comfortable break good sweat comfort home couple month used time week far regret complaint purchase also price right
772,1.0,0,See Saw Seat,easy assemble got christmas able ride seat tighten time get ride seat move present time communication seller see done fix update omce kmow
773,5.0,0,vroom vroom vroom,bike week took minute put together biggie alli used daily work great issue noisy worried chain driven put music go husband spin instructor pleased bike well price right thing wish display show speed distance hey paid money bike gotten great home spin bike
774,5.0,0,Great bike and great price,researching reading review review purchased bike assembly took minute easy box heavy getting box little challenging alone recommend someone help part found lowest seat adjustment still high took nob seems work hear noise fly wheel bad expected reading review tune watching tv listening music price bike little noise nothing went sporting good store bike recommend anyone seat hurt booty gel cover used use cycle class buy thank later
775,5.0,0,Second Bike for Peleton Account. ,great quality easy assemble peleton bought bike second home use peleton streaming apple tv riding bike work great
776,4.0,0,Good bike for the value with one exception,year use pretty extensively min day x week durable quiet get good workout complaint bike pedal others commented negatively also left pedal obviously defect common issue spin mechanism allows pedal spin freely lock cause pedal fall advice buy save hassle buy cheap pair pedal axle put get go work great thing seat comfortable time get accustomed experience customer service good opposed people experience responsive email wanted let know defect pedal go extra mile make situation right sending new pair pedal sure use nonetheless customer service experience good end
777,4.0,0,"6'5"" 255lbs - no issue with the adjustability, stability, and strength",hour bike far im currently lb issue adjustability stability strength brake resistance modulates pretty well put real bike seat pedal fine overall good value money background mountain biking many year xc dh owned many mid high end bike
778,1.0,0,Pedal fell off,pedal fell son using fell causing injury examining cant figure happen
779,5.0,0,easy to put together,came well packaged easy put together bit hesitant first look kind small image big girl thankfully support weight well yet encounter problem
780,1.0,1,Arrives with defective parts and no customer service available!,excited buy however part defective tried call customer service answering phone checking message disappointed
781,5.0,0,Great quality. I really enjoy it,great quality really enjoy added aftermarket item price base unit great sometimes squeak peddling awesome gear
782,4.0,2,Missing part in the box - problem resolved,bike missing part made handlebar quite wobbly spoke customer service team sunny agreed send missing part even bike longer warranty waited long complaining missing part looking forward using handlebar wobble found seat uncomfortable ordered seat much comfortable quite heavy stable good deal price
783,5.0,7,Great Bike! Read tips for keeping it 5/5 stars.,purchased spin bike great sale year ago happy tell good ugly get pay bike heavy stable bare bone seat handlebar adjustment get pretty stiff set hard change use silicone lubricant bar help big downfall handlebar move forward back tilt make use limiting back pain sufferer bike option frustrating loud squeal hear put medium resistance shortly use irritating read review people taken flywheel assembly apart squeal complained company etc ridiculous simple fix buy silicone lubricant apply flywheel regular maintenance forget cleaning use prevent sweat corrosion lubricate chain occasion regular bike tune regularly
784,5.0,1,Love it!,absolutely love bike fairly quiet wobble use reminds spin bike gym took minute put together super simple quality inexpensive definitely recommend
785,5.0,1,Great for training,nd shipment something happened st delivery giant slash cracked chain cover minute running son love sturdy comfortable well put price
786,5.0,1,Great Spin Bike!!,month love using others describe feel much higher quality product think given low price really solid smooth feel issue resistance pad squeaking flywheel drop teflon lubricant easily fixed problem customer service sunny health fitness helpful wanted extra seat attachment wife use different seat switch easily promptly sent spare part reasonable cost recently purchased wireless spinner cadence monitor work beautifully bike paired cadence monitor wireless heart rate monitor garmin digifit iphone combination monitoring equipment smooth ride give great spinning workout experience
787,5.0,0,Great value!,bike week far amazing husband use love pretty quiet seat better come pay time
788,3.0,0,Sunny bike,purchased bike based decent review first week started riding left wheel always became loose ive emailed sunny almost month response cant get anyone phone also seems squeaky otherwise decent bike
789,4.0,2,Great spin bike for the money,got bike couple day happy easy put together heavy prepared big bulky box weight add appeal bike seems sturdy far added spd pedal purchased separately allow use cycling shoe reviewer mention noise hear headphone far height fine lowest setting complaint tension adjustment subtle spin bike gym live price paid overall pleased purchase
790,5.0,0,Healthcare answer,easy assemble easy move around great everyday exercise matter weather air quality
791,4.0,1,"Great bike, Terrible seat",easy put together solid construction make bit grinding spinning noise loud enough bother neighbor real complaint thing seat incredibly uncomfortable big guy seat small hard rock barely long shop quality cushion
792,5.0,1,3 years still works flawlessly,year later still work flawlessly
793,4.0,1,Excellent at home bike,ordered bike saturday arrived following tuesday amazingly fast shipping busy not seem find time go gym lately effort get shape wedding decided time buy something use home skeptical low price bike sturdy comfortable quiet reason gave seat doesnt adjust properly comfortably seated climb find leaning far forward seat narrow im sure seat cover fix overall amazing bike price
794,5.0,0,Amazing,better expected price heavy sturdy gym spin bike nice number tension level sync apps easy put together noisy crank tension maybe need something
795,4.0,0,Great cycling bike for the price but the seat is ...,great cycling bike price seat uncomfortable even pad purchased separately tilt upward front making painful sit bike also make lot noise cycling otherwise job
796,4.0,0,Sunny Health & Fitness Pro Indoor Cycling Bike,bike built sturdy assembly easy took minute top front wheel good weight adjustment easy make issue left pedal clicked day wheni pedaled granted using bike hour day heavy usage fortunately went away surprised good quality sturdiness better gym spinning bike bally definitely recommend anyone looking toget quality bike inexpensive price go
797,5.0,0,Love it!,ok let say really pleasantly surprised quality teaching spinning year pretty picky equipment decided wanted bike home looked many different bike online landed seemed review good balance price quality initially going buy lb flywheel went lb instead solid smooth quiet think amount play tension perfect adjustment like see fore aft handlebar live lb solid rock position thrilled purchase looking good home bike good price check
798,5.0,2,Excellent Spin Bike,excellent spin bike meet need avid cyclist former spin instructor bike definitely worth money equal expensive gym bike ridden see hold mile year old assembled problem definitely spend bike bell whistle needed bike accessory separate handlebar water bottle iphone mount ordered amazon ready hour spinning pleasure bike ship free prime probably shipping cost saving
799,2.0,1,"Product is fine at first but needed some maintenance, then become worse",right assembled stationary bike clicking noise pedal emailed sunny health fitness gave instruction fix problem turned chain connecting pedal flywheel loose hard fix regular tool box fixed noise pedaling bearable range overall product fine take maintenance edit month later noise come friction flywheel becomes worse
800,5.0,23,so glad i bought this bike!,spinning instructor year teaching variety club bike mid range high end due husband cross country work transfer recently retired teaching wanted able spin home spending fortune bike solid feel compare favorably bike used higher end club going change pedal clip use cycling shoe pedal came bike fine anyone use clip glad bike electronic gadget break inaccurate anyway note bike came day damage easy put together following direction took min disassemble part explains direction female mechanical anyone bike fit fine fact even seat lowest setting reviewer think tall know proper spin bike fit feel compelled explain due review read fit highly recommend going least spin indoor cycle class asking instructor show correct fit body hard knee sit low bike far forward sitting extend leg leg degree bend extended leg almost straight slightest fraction bend large bend knee raise seat leg almost straight hyper extending bent knee side knee shold directly ankle knee forward ankle push seat back able find u tube video important hour long ride variety sitting standing hill climbing sprinting bike feel smooth solid whole time take much turning resistance knob get resistance even least resistance setting still enough keep bike feeling loose control gym point weigh perspective different lb person easy move room due wheel store closet pull bedroom using quiet hear music cycling also hear tv normal volume problem even high end bike gym make least much noise bike moving totally silent definitely recommend bike
801,1.0,3,Urgent Fix or Replace Item,pedal fell month ago trying item fixed replaced purchased warranty smartguard year fitness equipment replacement plan point successful need someone get touch asap instruction fix replace indoor bike warranty thanks
802,5.0,3,Great bike for the money!,received bike quickly fed took time assemble design nearly identical first spin bike trained granted convenience improvement bike please bike work well recommend prepare maintain teflon lube pad chain still basic maintenance give road city bike spin basement winter
803,5.0,0,I like this bike a lot,bike lot first type used still getting used feedback seat uncomfortable liking preference fully adjustable work great little rickety handle bar see tightened great match price quality adjustability height
804,5.0,0,Strong and quality pruduct,well made bike adjustment nut easy handle quality material
805,5.0,0,Great bike for price,cheaper alternative pelaton great far
806,4.0,2,Love this bike,love bike smooth ride complaint moderately noisy riding use headphone listen music riding hear great bike feel sturdy buy seat cushion cushion making butt sore
807,2.0,1,The bike itself is easy to install and has a great stop mechanism,ouch ouch ouch seat uncomfortable buy new seat bike easy install great stop mechanism however struggle dealing horrible seat make apprehensive give higher rating decent bike bad seat
808,3.0,0,Cincinnati Kid,nice bike ride smooth handlebar loosest time ride end tightening someone help fix matter please
809,5.0,0,Great Buy!,nervous purchasing reading great review decided try glad bell whistle spin gym perfect working home sturdy simple put together
810,5.0,0,Solid Value. You get a lot for your money!,bike week solid construcrion setup easy quick give solid comfortable quiet workout great value get lot money bike thr saddle pretty solid want gel seat cover sure pedal reflector
811,4.0,0,Very good,good product strong good adjustment feature seat needed extra tighting muscle force initial use brake smell heavy use seem issue left right brake pad land equally flat wheel adjusting resistance setting
812,2.0,0,Dont get if you are going to use a lot,year used time week bracket axle cracked using contacted company time get replacement part gotten
813,5.0,0,Great workout and well constructed,owned spinbike nearly year little average weight use regularly held well easy move quiet great way exercise easy workout increase resistance aerobic highly recommend product
814,4.0,1,Solid construction for price point.,dislike seat narrow handle bar far forward basic rehab riding versus body posture assuming cyclist riding position cyclist posture place undue stress lower back shoulder
815,5.0,0,Can handle high resistance !,second spin bike purchased broke first different brand go super hard daily lot resistance needed bike handle hiits thing
816,5.0,8,good bike fot the price,got bike want spend winter riding road biker someone love ride summer thinking getting trainer decided bike arrived super fast easy put together supplied tool box recommend putting little bike grease handlebar stem little snug grease worked great slide ease quiet friend jealous honestly price great deal bummed snow coming knowing riding winter
817,4.0,0,Very simple,bike easy assemble simple led screen track time distance anything simple brake pad determine resistance keep focused biking certain distance time go star rock hard seat u want purchase seat cover
818,5.0,2,Awesome entry level exercise bike with plenty of room to upgrade to your liking,happier far bike sturdy reasonably easy put together price amazing get bare bone easily gradable many way put clip pedal seat attachment fixture standard bicycle fare compatible ever comfortable real bicycle electronics figured fine use tablet phone realized meant cadence counter kind hard spin workout however see wide selection computer add option get bike offer entry level price ability customize exactly want trouble finding comfortable riding position mid range setting felt pad make awful squeal certain resistance sure something think case resistance system need upgrade much expensive bike real silence
819,5.0,0,Great Home Cycle Bike,nice ride home easy assembly con wheel make noise spinning nothing super loud rubbing noise probably something really care much wanted know mine
820,5.0,1,Easy setup and adjusting made it easy to use the ...,go cardio home gym easy setup adjusting made easy use first day got never issue resistance pedal adjustment knob great bike stand well lot sweat riding
821,4.0,1,Be sure to tighten brake assembly,nice solid spin bike easy assemble folk problem wheel suddenly locking peddling please sure tighten brake resistance pad center bolt brake assembly wiggle play
822,4.0,1,"Exactly what i wanted, gym-quality, basement-comfortability",first bike heavy box weighed something pound devil time getting flight stair installation sort easy bolt hold front frame part wheel go seat pretty complicated instruction bike arrived exactly amazon said undamaged set bike worked great absolute minimum resistance much harder thought lb easily adjusts size also extremely quiet barely even hear foot away seat comfortable bike seat overall satisfied purchase used amazon store card pay casually next month
823,5.0,0,Sunny Spin Bike Great Bike!,received day ordering extremely heavy well packaged exterior gauge box matter complany designed packaging well everything protected husband assembled minute used several time exactly wanted home spin bike tere side side sway smooth relatively quiet change seat personal preference prefer wider seat put much pressure unwanted area easy adjust seat height bar placement thing make perfect water bottle bracket easy fix shopped quite bit settled choice based mostly review amazon regret purchase
824,5.0,0,Great product at a great price.,using regularly year great beat price super high tech everything need provides solid workout front wheel make easy move around house
825,5.0,3,Great Bike for the Price,got wife thing wish computer added later love bike great bike price bought price great review different source review said company customer service great deal great bike price hopefully contact customer service ever
826,5.0,1,Awesome bike for the price,love indoor perfect little apartment
827,5.0,1,Excellent Buy,spinning fitness center month decided time purchase bike happy purchase bike excellent quality comperable bike fitness center assembly mostly complete box breeze first time taken time issue review felt obligated excellent value
828,4.0,8,But it and get fit,husband bought bike birthday also bought time lot road bike riding summer planned use spin bike warm ups use inclement weather bike extremely easy put together part packaged prevent damage damage bike husband used spinning instructor use take spin class local fitness center easily rival quality bike cost much sturdy sit firmly floor rock riding pleased price quality recommend anyone wanting get fit
829,5.0,1,Great product for the money,equipment surprisingly sturdy money easy assemble feel get great workout time unpacking piece broke away chain guard called company day promptly sent replacement part seat comfortable purchased gel seat cover greatly help ride happy product overall
830,5.0,2,Very easy set up,bought bike review easy set sturdy glad didnt spend bike come mostly assembled tinkering assembly
831,5.0,1,Lovin' it!,husband moved package basement set bike le minute trouble using bike week love sturdy comfortable quiet little smell use lot resistence kind something hot burning going look getting type lubrication crazy pedal replace eventually uncomfortable first ride tightened bolt attach strap piece pedal also rigged bike standard bicycle odometer speedometer view speed time interval bike great deal edited using bike month still thrilled switched pedal still like point
832,5.0,1,Great Bike So Far! :),far good week assembly easy box came slightly damaged unit damage well packed assembly took minute breaking open packaging unwrapping opening tool installing part instruction easy follow lowest setting seat right short leg leg shorter inch probably fit wearing shoe course caged pedal handle bar looked odd pretty comfortable seat actually fairly comfortable little hard bike seat rarely encounter super cushy bike seat manufactured cheaper range flywheel smooth quiet wheel front unit make breeze move thing wish tick mark number marking resistance knob resistance knob work great hard tell stop turning specific resistance wanted interval low setting high setting session double sided curved pointing sign also slight annoyance multiple user user comfortable particular setting overall bike seems sturdy beautifully designed capable fulfill novice spin cyclist happy purchase
833,2.0,2,Not for short people,wish enjoyed short even going tough time seat positioned way seems really tall people testing otherwise seemed sturdy well noisy live small apartment house wise decision overwhelmingly huge deal breaker people
834,5.0,0,This bike is awesome!!,received bike month riding time week absolutely everything bike small sturdy easy adjust height seat increase resistance price excellent level quality
835,5.0,0,Best for quality/value,compared expensive spin bike relative bargain solidly constructed easy put together slight adjustment work extremely well year still work well looking inexpensive spin bike sunny health bike seems best quality value
836,1.0,1,continues to get stuck seconds after I start pedaling.,purchased bike nursing school hoping great workout never used bike day way busy school contact amazon return even write review happy purchase
837,4.0,0,Great for the price! Cant beat it,amazing price however tensioner feel loose hard middle ground easy set quiet everything maxed height work
838,5.0,1,I do wear bike shorts with it and wear biking gloves for comfort as it is not heaving on padding but otherwise fantastic.,owned mine month least time week sometimes hour fabulous wear bike short wear biking glove comfort heaving padding otherwise fantastic
839,5.0,0,Good,easy assemble took min product described using week happy recommend looking reasonably priced indoor bike home use
840,4.0,0,overall happy,really glad purchased complaint seat come really uncomfortable went bought better seat walmart bc discomfort make want exercise long seems sturdy intended job think nice distance time tracker still happy purchase
841,4.0,1,"great bike, get a better seat if you are on the heavy side.",ridden higher end model gym think think lacking sturdier seat seat hurt butt riding minute weigh pound using bike time seat got crooked lean right make uncomfortable ride purchasing aftermarket saddle fitted build
842,1.0,0,"Awful, never again. Do not buy.",steaming pile garbage virtually resistance fly wheel pedaling bike hill climbing gear going get hurt criminal even sell thing
843,3.0,0,Let me first say that this is a great spin bike to have at home,short people let first say great spin bike home unfortunately inseam adjustable minimum inch still much height used anyway put much pressure knee great short bike
844,5.0,0,Bang for the buck,former cyclist trying get back shape natural gravitate sort stationary bike disappoint simple effecient great deal price point sure better ease assembly amazing going minute ability adjust positioning great accomodate people loud mechanism anyone complaining seat comfortable well especially racing bike get gel cover product expected price welcome addition home gym
845,5.0,0,I was pleasantly surprised it is sturdy and feels very much like a bike at the ...,worried price got bike par someone spent many hour spin class pleasantly surprised sturdy feel much bike gym see smell become issue pushing fly wheel hill ok
846,4.0,0,Great Quality!,nice sturdy price heavy never spinning road bike type bicycle ordered take getting used great ride get going adjust seat handle bar several time finally got perfect position
847,5.0,0,,best
848,4.0,2,Sunny Spinning Bike,love new bike using month spin class use time week ride hard sitting standing back forth far fantastic good bike money also bought bike heavier fly wheel also heavier weight capacity proven good hoping many year come
849,3.0,0,"Worked great for a bit, now the pedal came off",alright honest never spun bought bike really interested hate gym working decided get based review mostly good got march immediately buy seat cover water bottle holder also bought silicon spray get loud cranked resistance turned right march problem handlebar bit loose willing sacrifice spending bike today spinning month bought right pedal came right due attaching correctly however bearing popped right e mailed sunny really think anything well purchased replacement pedal amazon get day thank amazon prime spinning money decent build quality expect spending amount money
850,5.0,0,Excellent spin bike for the money - can't be beat,looking bike trainer came spin bike based positive review decided buy came mostly assembled beware box heavy packaged well bolt floor bar add seat handlebar pedal take hour bike well made clean weld nice finish component definitely recommend
851,5.0,1,LOOOOve!!!,love love bike ride x week decent dupe peleton hard put together strong sturdy get bike peleton app great workout
852,5.0,0,Works great,price not beat using everyday issue
853,5.0,0,Great value!,flaw brake lever encroaches space need step exercycle need better design
854,1.0,5,This bike is a piece of trash. Worked well ...,piece trash worked well ride developed high pitch chirping noise come wheel rub brake pad loud unusable fiddled trying make go luck avoid purchasing update sunny support able help fix anything based comment doubt
